{
  "$schema": "https://json-schema.org/draft/2020-12/schema",
  "$id": "https://tensorfs.dev/spec/v1/contract.schema.json",
  "title": "tensorfs-contract-v1",
  "description": "A tensor layout contract: the declarative, versioned input that identifies a file's layout and directs its chunking seams.",
  "type": "object",
  "additionalProperties": false,
  "required": ["format", "tensors"],
  "dependentRequired": { "name": ["version"], "version": ["name"] },
  "properties": {
    "format": { "const": "tensorfs-contract-v1" },
    "name": {
      "description": "The handle: <producer>.<format>, as gen-worker spells layout contracts. Present with `version` on curated-library documents; ABSENT on author-constructed customs, whose identity is the SHA-256 of the canonical rendering (stamp `sha256:<hex>`).",
      "type": "string",
      "maxLength": 64,
      "pattern": "^[a-z0-9]+\\.[a-z0-9][a-z0-9._-]*$"
    },
    "version": { "type": "integer", "minimum": 1 },
    "description": { "type": "string" },
    "dtype": {
      "description": "Optional serve-side load dtype, torch spelling (bfloat16, float8_e4m3fn, ...). ADDITIVE: absent from a document means absent from the canonical rendering, so pre-existing digests are unchanged. Nothing matches on it; per-tensor `dtypes` remain the matcher's constraint.",
      "type": "string",
      "minLength": 1,
      "maxLength": 32,
      "pattern": "^[a-z0-9_]+$"
    },
    "tensors": {
      "type": "array",
      "minItems": 1,
      "items": { "$ref": "#/$defs/tensor" }
    },
    "sets": {
      "description": "Named removable tensor sets, by pattern.",
      "type": "object",
      "additionalProperties": {
        "type": "array",
        "minItems": 1,
        "items": { "$ref": "#/$defs/pattern" }
      }
    }
  },
  "$defs": {
    "pattern": {
      "description": "Literal text with {i} holes, each matching one non-negative integer without leading zeros. Two adjacent holes, or a digit immediately after a hole, are ambiguous and refuse.",
      "type": "string",
      "minLength": 1,
      "maxLength": 512
    },
    "tensor": {
      "type": "object",
      "additionalProperties": false,
      "required": ["role", "pattern"],
      "properties": {
        "role": {
          "description": "Spelling-independent identity, carrying the same holes in the same order as `pattern`.",
          "$ref": "#/$defs/pattern"
        },
        "pattern": {
          "description": "The tensor's spelling in the file.",
          "$ref": "#/$defs/pattern"
        },
        "dtypes": {
          "description": "Accepted dtype names (safetensors spelling; ggml type names for GGUF). Empty accepts any.",
          "type": "array",
          "items": { "type": "string" }
        },
        "rank": { "type": "integer", "minimum": 0 },
        "required": { "type": "boolean", "default": true },
        "fusion": { "$ref": "#/$defs/fusion" }
      }
    },
    "fusion": {
      "description": "A fusion along the outermost axis: `groups` repetitions of the `parts` cycle. groups=1 is plain stacking; groups>1 is an interleave (H3's head-major qkv is 56). Runs below 1 MiB produce no cut points.",
      "type": "object",
      "additionalProperties": false,
      "required": ["axis", "parts"],
      "properties": {
        "axis": {
          "description": "Only the outermost axis is a byte concatenation.",
          "const": 0
        },
        "groups": { "type": "integer", "minimum": 1, "default": 1 },
        "parts": {
          "type": "array",
          "minItems": 1,
          "items": {
            "type": "object",
            "additionalProperties": false,
            "required": ["role", "share"],
            "properties": {
              "role": {
                "description": "Role suffix in the split packaging. Empty only as the sole part of an interleaved slice.",
                "type": "string"
              },
              "share": { "type": "integer", "minimum": 1 }
            }
          }
        }
      }
    }
  }
}
