{
  "format": "tensorfs-contract-v1",
  "name": "minimax.h3-dit-native",
  "version": 1,
  "dtype": "bfloat16",
  "description": "MiniMax-H3 DiT, native/DiffSynth spelling (535 keys, 66.28 GB). Attention is one fused qkv_proj per block, HEAD-INTERLEAVED: 56 head-major triples (q,k,v adjacent within each head), not three stacked blocks. 11.56 GB of the DiT -- 17.4% -- sits behind those seams.",
  "tensors": [
    {
      "role": "blocks.{i}.attn.qkv",
      "pattern": "blocks.{i}.attn.qkv_proj.weight",
      "dtypes": ["BF16"],
      "rank": 2,
      "fusion": {
        "axis": 0,
        "groups": 56,
        "parts": [
          { "role": "q", "share": 1 },
          { "role": "k", "share": 1 },
          { "role": "v", "share": 1 }
        ]
      }
    },
    {
      "role": "blocks.{i}.attn.out",
      "pattern": "blocks.{i}.attn.out_proj.weight",
      "rank": 2,
      "required": false
    },
    {
      "role": "blocks.{i}.attn.q_norm",
      "pattern": "blocks.{i}.attn.q_norm.weight",
      "required": false
    },
    {
      "role": "blocks.{i}.attn.k_norm",
      "pattern": "blocks.{i}.attn.k_norm.weight",
      "required": false
    },
    {
      "role": "blocks.{i}.mlp.fc1",
      "pattern": "blocks.{i}.mlp.fc1.weight",
      "rank": 2,
      "required": false
    },
    {
      "role": "blocks.{i}.mlp.fc2",
      "pattern": "blocks.{i}.mlp.fc2.weight",
      "rank": 2,
      "required": false
    },
    {
      "role": "blocks.{i}.adaln.weight",
      "pattern": "blocks.{i}.adaln_proj.linear.weight",
      "rank": 2,
      "required": false
    },
    {
      "role": "blocks.{i}.adaln.bias",
      "pattern": "blocks.{i}.adaln_proj.linear.bias",
      "rank": 1,
      "required": false
    }
  ],
  "sets": {
    "adaln_projections": [
      "blocks.{i}.adaln_proj.linear.weight",
      "blocks.{i}.adaln_proj.linear.bias",
      "final_layer.adaln_proj.linear.weight",
      "final_layer.adaln_proj.linear.bias"
    ]
  }
}
