{
  "format": "tensorfs-contract-v1",
  "name": "sdxl.clip-g-fused-qkv",
  "version": 1,
  "description": "SDXL single-file packaging of OpenCLIP ViT-bigG: attention projections are one fused in_proj along the outermost axis, q|k|v in equal thirds. Measured at 0.315 GB per SDXL pair in the variant-corpus audit (F5).",
  "tensors": [
    {
      "role": "clip_g.layers.{i}.attn.qkv.weight",
      "pattern": "conditioner.embedders.1.model.transformer.resblocks.{i}.attn.in_proj_weight",
      "rank": 2,
      "fusion": {
        "axis": 0,
        "parts": [
          { "role": "q", "share": 1 },
          { "role": "k", "share": 1 },
          { "role": "v", "share": 1 }
        ]
      }
    },
    {
      "role": "clip_g.layers.{i}.attn.qkv.bias",
      "pattern": "conditioner.embedders.1.model.transformer.resblocks.{i}.attn.in_proj_bias",
      "rank": 1,
      "required": false,
      "fusion": {
        "axis": 0,
        "parts": [
          { "role": "q", "share": 1 },
          { "role": "k", "share": 1 },
          { "role": "v", "share": 1 }
        ]
      }
    }
  ]
}
