{
  "format": "tensorfs-contract-v1",
  "name": "flux2-klein.diffusers-bf16",
  "version": 1,
  "dtype": "bfloat16",
  "description": "The canonical FLUX.2 Klein serve layout: the diffusers Flux2Transformer2DModel (Flux2KleinPipeline), all-bf16, every family derived from the real safetensors header of black-forest-labs/FLUX.2-klein-4B. This is NOT the timm block spelling dit.blocks-fused-qkv@1 declares - that fragment matches ZERO tensors in a flux tree (measured, tensorfs#124), because flux serves the diffusers spelling: 5 double-stream transformer_blocks and 20 single_transformer_blocks, no blocks.{i}.attn.qkv anywhere. THE SINGLE-STREAM FUSION IS NOT EQUAL THIRDS. single_transformer_blocks.{i}.attn.to_qkv_mlp_proj.weight is [27648, 3072] and fuses the attention projections AND the gated MLP input: q|k|v are 3072 each and the MLP input is 18432, because the MLP is gated and emits 2 x (mlp_ratio 3.0 x inner_dim 3072) = 2 x 9216. Shares are 1:1:1:6 in units of 3072, confirmed by attn.to_out.weight [3072, 12288] = 3072 attn + 9216 post-gate mlp and by the double-stream ff.linear_in [18432, 3072] / ff.linear_out [3072, 9216] pair. Thirds would mis-cut 3.4 GB of the 4B transformer. The role vocabulary is aligned with BFL's NATIVE packaging, which the same repo ships beside the diffusers tree (flux-2-klein-4b.safetensors, 149 tensors to the diffusers 169 - exactly 5 blocks x 2 streams x 2, the double-stream qkv this packaging splits and that one fuses in equal thirds). So to_q/to_k/to_v and add_q_proj/add_k_proj/add_v_proj carry #q/#k/#v role suffixes over one qkv role, which is what makes a native <-> diffusers conversion a run-preserving derive rather than a refusal, exactly as the sdxl.clip-g-* pair does. TRANSFORMER ONLY, deliberately, on the tensorfs#121 rule: AutoencoderKLFlux2 is the same key spelling as SD2's and SDXL's AutoencoderKL (251 keys vs 248, the extra three being the bn.* buffers, every shared key agreeing on rank), so declaring it would tie sdxl.diffusers-bf16@1 on any SDXL vae file and win it on name order; and the text encoder is a stock Qwen3ForCausalLM spelling that any future Qwen3 lane would collide with. The transformer is the compile subject and the only component that identifies the family. Derived from the 4B checkpoint. FLUX.2-klein-9B is gated (gated: auto - the sibling listing is public but every raw file read is 401 unauthenticated), so its layout is UNVERIFIED; if 9B spells a family differently this document refuses it loudly rather than half-matching. Top-level dtype is the serve-side load dtype (ctx.lane.dtype); the per-tensor dtypes are the matcher's constraint that this really is the bf16 packaging.",
  "tensors": [
    {
      "role": "txt_in.weight",
      "pattern": "context_embedder.weight",
      "dtypes": [
        "BF16"
      ],
      "rank": 2,
      "required": false
    },
    {
      "role": "double_stream_modulation_img.weight",
      "pattern": "double_stream_modulation_img.linear.weight",
      "dtypes": [
        "BF16"
      ],
      "rank": 2,
      "required": false
    },
    {
      "role": "double_stream_modulation_txt.weight",
      "pattern": "double_stream_modulation_txt.linear.weight",
      "dtypes": [
        "BF16"
      ],
      "rank": 2,
      "required": false
    },
    {
      "role": "final_layer.adaln.weight",
      "pattern": "norm_out.linear.weight",
      "dtypes": [
        "BF16"
      ],
      "rank": 2,
      "required": false
    },
    {
      "role": "final_layer.linear.weight",
      "pattern": "proj_out.weight",
      "dtypes": [
        "BF16"
      ],
      "rank": 2,
      "required": false
    },
    {
      "role": "single_stream_modulation.weight",
      "pattern": "single_stream_modulation.linear.weight",
      "dtypes": [
        "BF16"
      ],
      "rank": 2,
      "required": false
    },
    {
      "role": "single.{i}.key_norm.weight",
      "pattern": "single_transformer_blocks.{i}.attn.norm_k.weight",
      "dtypes": [
        "BF16"
      ],
      "rank": 1,
      "required": false
    },
    {
      "role": "single.{i}.query_norm.weight",
      "pattern": "single_transformer_blocks.{i}.attn.norm_q.weight",
      "dtypes": [
        "BF16"
      ],
      "rank": 1,
      "required": false
    },
    {
      "role": "single.{i}.linear2.weight",
      "pattern": "single_transformer_blocks.{i}.attn.to_out.weight",
      "dtypes": [
        "BF16"
      ],
      "rank": 2,
      "required": false
    },
    {
      "role": "single.{i}.linear1.weight",
      "pattern": "single_transformer_blocks.{i}.attn.to_qkv_mlp_proj.weight",
      "dtypes": [
        "BF16"
      ],
      "rank": 2,
      "required": false,
      "fusion": {
        "axis": 0,
        "parts": [
          {
            "role": "q",
            "share": 1
          },
          {
            "role": "k",
            "share": 1
          },
          {
            "role": "v",
            "share": 1
          },
          {
            "role": "mlp",
            "share": 6
          }
        ]
      }
    },
    {
      "role": "time_in.fc1.weight",
      "pattern": "time_guidance_embed.timestep_embedder.linear_1.weight",
      "dtypes": [
        "BF16"
      ],
      "rank": 2,
      "required": false
    },
    {
      "role": "time_in.fc2.weight",
      "pattern": "time_guidance_embed.timestep_embedder.linear_2.weight",
      "dtypes": [
        "BF16"
      ],
      "rank": 2,
      "required": false
    },
    {
      "role": "double.{i}.txt_attn.qkv.weight#k",
      "pattern": "transformer_blocks.{i}.attn.add_k_proj.weight",
      "dtypes": [
        "BF16"
      ],
      "rank": 2,
      "required": false
    },
    {
      "role": "double.{i}.txt_attn.qkv.weight#q",
      "pattern": "transformer_blocks.{i}.attn.add_q_proj.weight",
      "dtypes": [
        "BF16"
      ],
      "rank": 2,
      "required": false
    },
    {
      "role": "double.{i}.txt_attn.qkv.weight#v",
      "pattern": "transformer_blocks.{i}.attn.add_v_proj.weight",
      "dtypes": [
        "BF16"
      ],
      "rank": 2,
      "required": false
    },
    {
      "role": "double.{i}.txt_attn.key_norm.weight",
      "pattern": "transformer_blocks.{i}.attn.norm_added_k.weight",
      "dtypes": [
        "BF16"
      ],
      "rank": 1,
      "required": false
    },
    {
      "role": "double.{i}.txt_attn.query_norm.weight",
      "pattern": "transformer_blocks.{i}.attn.norm_added_q.weight",
      "dtypes": [
        "BF16"
      ],
      "rank": 1,
      "required": false
    },
    {
      "role": "double.{i}.img_attn.key_norm.weight",
      "pattern": "transformer_blocks.{i}.attn.norm_k.weight",
      "dtypes": [
        "BF16"
      ],
      "rank": 1,
      "required": false
    },
    {
      "role": "double.{i}.img_attn.query_norm.weight",
      "pattern": "transformer_blocks.{i}.attn.norm_q.weight",
      "dtypes": [
        "BF16"
      ],
      "rank": 1,
      "required": false
    },
    {
      "role": "double.{i}.txt_attn.proj.weight",
      "pattern": "transformer_blocks.{i}.attn.to_add_out.weight",
      "dtypes": [
        "BF16"
      ],
      "rank": 2,
      "required": false
    },
    {
      "role": "double.{i}.img_attn.qkv.weight#k",
      "pattern": "transformer_blocks.{i}.attn.to_k.weight",
      "dtypes": [
        "BF16"
      ],
      "rank": 2,
      "required": false
    },
    {
      "role": "double.{i}.img_attn.proj.{i}.weight",
      "pattern": "transformer_blocks.{i}.attn.to_out.{i}.weight",
      "dtypes": [
        "BF16"
      ],
      "rank": 2,
      "required": false
    },
    {
      "role": "double.{i}.img_attn.qkv.weight#q",
      "pattern": "transformer_blocks.{i}.attn.to_q.weight",
      "dtypes": [
        "BF16"
      ],
      "rank": 2,
      "required": false
    },
    {
      "role": "double.{i}.img_attn.qkv.weight#v",
      "pattern": "transformer_blocks.{i}.attn.to_v.weight",
      "dtypes": [
        "BF16"
      ],
      "rank": 2,
      "required": false
    },
    {
      "role": "double.{i}.img_mlp.fc1.weight",
      "pattern": "transformer_blocks.{i}.ff.linear_in.weight",
      "dtypes": [
        "BF16"
      ],
      "rank": 2,
      "required": false
    },
    {
      "role": "double.{i}.img_mlp.fc2.weight",
      "pattern": "transformer_blocks.{i}.ff.linear_out.weight",
      "dtypes": [
        "BF16"
      ],
      "rank": 2,
      "required": false
    },
    {
      "role": "double.{i}.txt_mlp.fc1.weight",
      "pattern": "transformer_blocks.{i}.ff_context.linear_in.weight",
      "dtypes": [
        "BF16"
      ],
      "rank": 2,
      "required": false
    },
    {
      "role": "double.{i}.txt_mlp.fc2.weight",
      "pattern": "transformer_blocks.{i}.ff_context.linear_out.weight",
      "dtypes": [
        "BF16"
      ],
      "rank": 2,
      "required": false
    },
    {
      "role": "img_in.weight",
      "pattern": "x_embedder.weight",
      "dtypes": [
        "BF16"
      ],
      "rank": 2,
      "required": false
    }
  ]
}
