{
  "format": "tensorfs-contract-v1",
  "name": "ltx-2-upsampler.diffusers-bf16",
  "version": 1,
  "dtype": "bfloat16",
  "description": "GENERATED CANDIDATE - NOT RATIFIED. The LTX-2 2x spatial latent upsampler (LTX2LatentUpsamplerModel): a pure 3-D\nconvnet bound beside the LTX-2 DiT for the two-stage 1080p/4K recipe, flat BF16.\nLATENT_UPSAMPLER ONLY - the same repo ships a vae, and declaring it would tie this document to\nthe DiT's own checkpoint. This tree shares ZERO keys with ltx-2.diffusers-bf16@1, which is the\nmeasurement that makes Ltx2Upsampler a separate model type rather than a variant of Ltx2. Derived mechanically by tensorfs.generate from headers only - no tensor byte was read. upsampler: 72 tensors 24 declarations cover 72 tensors (8 singleton, 16 indexed) dtypes: BF16 x72. RATIFICATION OWED: (1) ROLES are mechanical (role == pattern). Rename any tensor whose bytes are the same bytes another packaging spells differently - that is the only thing that makes a cross-packaging derive possible instead of a refusal. (2) FUSIONS are undeclared. A header cannot see a fused axis, so a fused qkv/gate-up must be declared by a human reading the model's config (head count, hidden size); a wrong one is a ~90%-error split that never crashes. (3) SETS are undeclared (no subset-snapshot groups). (4) COMPONENT SCOPE is the caller's: declaring a shared encoder ties this document to every family that ships the same one (tensorfs#121).",
  "tensors": [
    {
      "role": "final_conv.bias",
      "pattern": "final_conv.bias",
      "dtypes": [
        "BF16"
      ],
      "rank": 1
    },
    {
      "role": "final_conv.weight",
      "pattern": "final_conv.weight",
      "dtypes": [
        "BF16"
      ],
      "rank": 5
    },
    {
      "role": "initial_conv.bias",
      "pattern": "initial_conv.bias",
      "dtypes": [
        "BF16"
      ],
      "rank": 1
    },
    {
      "role": "initial_conv.weight",
      "pattern": "initial_conv.weight",
      "dtypes": [
        "BF16"
      ],
      "rank": 5
    },
    {
      "role": "initial_norm.bias",
      "pattern": "initial_norm.bias",
      "dtypes": [
        "BF16"
      ],
      "rank": 1
    },
    {
      "role": "initial_norm.weight",
      "pattern": "initial_norm.weight",
      "dtypes": [
        "BF16"
      ],
      "rank": 1
    },
    {
      "role": "post_upsample_res_blocks.{i}.conv1.bias",
      "pattern": "post_upsample_res_blocks.{i}.conv1.bias",
      "dtypes": [
        "BF16"
      ],
      "rank": 1
    },
    {
      "role": "post_upsample_res_blocks.{i}.conv1.weight",
      "pattern": "post_upsample_res_blocks.{i}.conv1.weight",
      "dtypes": [
        "BF16"
      ],
      "rank": 5
    },
    {
      "role": "post_upsample_res_blocks.{i}.conv2.bias",
      "pattern": "post_upsample_res_blocks.{i}.conv2.bias",
      "dtypes": [
        "BF16"
      ],
      "rank": 1
    },
    {
      "role": "post_upsample_res_blocks.{i}.conv2.weight",
      "pattern": "post_upsample_res_blocks.{i}.conv2.weight",
      "dtypes": [
        "BF16"
      ],
      "rank": 5
    },
    {
      "role": "post_upsample_res_blocks.{i}.norm1.bias",
      "pattern": "post_upsample_res_blocks.{i}.norm1.bias",
      "dtypes": [
        "BF16"
      ],
      "rank": 1
    },
    {
      "role": "post_upsample_res_blocks.{i}.norm1.weight",
      "pattern": "post_upsample_res_blocks.{i}.norm1.weight",
      "dtypes": [
        "BF16"
      ],
      "rank": 1
    },
    {
      "role": "post_upsample_res_blocks.{i}.norm2.bias",
      "pattern": "post_upsample_res_blocks.{i}.norm2.bias",
      "dtypes": [
        "BF16"
      ],
      "rank": 1
    },
    {
      "role": "post_upsample_res_blocks.{i}.norm2.weight",
      "pattern": "post_upsample_res_blocks.{i}.norm2.weight",
      "dtypes": [
        "BF16"
      ],
      "rank": 1
    },
    {
      "role": "res_blocks.{i}.conv1.bias",
      "pattern": "res_blocks.{i}.conv1.bias",
      "dtypes": [
        "BF16"
      ],
      "rank": 1
    },
    {
      "role": "res_blocks.{i}.conv1.weight",
      "pattern": "res_blocks.{i}.conv1.weight",
      "dtypes": [
        "BF16"
      ],
      "rank": 5
    },
    {
      "role": "res_blocks.{i}.conv2.bias",
      "pattern": "res_blocks.{i}.conv2.bias",
      "dtypes": [
        "BF16"
      ],
      "rank": 1
    },
    {
      "role": "res_blocks.{i}.conv2.weight",
      "pattern": "res_blocks.{i}.conv2.weight",
      "dtypes": [
        "BF16"
      ],
      "rank": 5
    },
    {
      "role": "res_blocks.{i}.norm1.bias",
      "pattern": "res_blocks.{i}.norm1.bias",
      "dtypes": [
        "BF16"
      ],
      "rank": 1
    },
    {
      "role": "res_blocks.{i}.norm1.weight",
      "pattern": "res_blocks.{i}.norm1.weight",
      "dtypes": [
        "BF16"
      ],
      "rank": 1
    },
    {
      "role": "res_blocks.{i}.norm2.bias",
      "pattern": "res_blocks.{i}.norm2.bias",
      "dtypes": [
        "BF16"
      ],
      "rank": 1
    },
    {
      "role": "res_blocks.{i}.norm2.weight",
      "pattern": "res_blocks.{i}.norm2.weight",
      "dtypes": [
        "BF16"
      ],
      "rank": 1
    },
    {
      "role": "upsampler.0.bias",
      "pattern": "upsampler.0.bias",
      "dtypes": [
        "BF16"
      ],
      "rank": 1
    },
    {
      "role": "upsampler.0.weight",
      "pattern": "upsampler.0.weight",
      "dtypes": [
        "BF16"
      ],
      "rank": 4
    }
  ]
}
