{
  "format": "tensorfs-contract-v1",
  "name": "minimax.h3-dit-diffusers",
  "version": 1,
  "description": "MiniMax-H3 DiT, diffusers repackaging (638 keys, 66.28 GB) -- what the hub actually ships. Attention is split to_q/to_k/to_v. Each is declared as 56 head slices so its runs are exactly the native contract's interleaved seam runs: the two packagings share every attention byte despite reading them in different orders. Exactly one key is spelled the same in both layouts.",
  "tensors": [
    {
      "role": "blocks.{i}.attn.qkv#q",
      "pattern": "transformer_blocks.{i}.attn.to_q.weight",
      "dtypes": ["BF16"],
      "rank": 2,
      "fusion": {
        "axis": 0,
        "groups": 56,
        "parts": [{ "role": "", "share": 1 }]
      }
    },
    {
      "role": "blocks.{i}.attn.qkv#k",
      "pattern": "transformer_blocks.{i}.attn.to_k.weight",
      "dtypes": ["BF16"],
      "rank": 2,
      "fusion": {
        "axis": 0,
        "groups": 56,
        "parts": [{ "role": "", "share": 1 }]
      }
    },
    {
      "role": "blocks.{i}.attn.qkv#v",
      "pattern": "transformer_blocks.{i}.attn.to_v.weight",
      "dtypes": ["BF16"],
      "rank": 2,
      "fusion": {
        "axis": 0,
        "groups": 56,
        "parts": [{ "role": "", "share": 1 }]
      }
    },
    {
      "role": "blocks.{i}.attn.out",
      "pattern": "transformer_blocks.{i}.attn.to_out.0.weight",
      "rank": 2,
      "required": false
    },
    {
      "role": "blocks.{i}.attn.q_norm",
      "pattern": "transformer_blocks.{i}.attn.norm_q.weight",
      "required": false
    },
    {
      "role": "blocks.{i}.attn.k_norm",
      "pattern": "transformer_blocks.{i}.attn.norm_k.weight",
      "required": false
    },
    {
      "role": "blocks.{i}.mlp.fc1",
      "pattern": "transformer_blocks.{i}.ff.net.0.proj.weight",
      "rank": 2,
      "required": false
    },
    {
      "role": "blocks.{i}.mlp.fc2",
      "pattern": "transformer_blocks.{i}.ff.net.2.weight",
      "rank": 2,
      "required": false
    },
    {
      "role": "blocks.{i}.adaln.weight",
      "pattern": "transformer_blocks.{i}.adaln_proj.linear.weight",
      "rank": 2,
      "required": false
    },
    {
      "role": "blocks.{i}.adaln.bias",
      "pattern": "transformer_blocks.{i}.adaln_proj.linear.bias",
      "rank": 1,
      "required": false
    }
  ],
  "sets": {
    "adaln_projections": [
      "transformer_blocks.{i}.adaln_proj.linear.weight",
      "transformer_blocks.{i}.adaln_proj.linear.bias",
      "norm_out.linear.weight",
      "norm_out.linear.bias"
    ]
  }
}
