{
  "format": "tensorfs-contract-v1",
  "name": "sdxl.clip-g-split-qkv",
  "version": 1,
  "description": "The diffusers spelling of the same OpenCLIP ViT-bigG: one tensor per projection. Its roles are exactly the fused contract's seam-part roles, which is what makes the two packagings share every data object.",
  "tensors": [
    {
      "role": "clip_g.layers.{i}.attn.qkv.weight#q",
      "pattern": "text_model.encoder.layers.{i}.self_attn.q_proj.weight",
      "rank": 2
    },
    {
      "role": "clip_g.layers.{i}.attn.qkv.weight#k",
      "pattern": "text_model.encoder.layers.{i}.self_attn.k_proj.weight",
      "rank": 2
    },
    {
      "role": "clip_g.layers.{i}.attn.qkv.weight#v",
      "pattern": "text_model.encoder.layers.{i}.self_attn.v_proj.weight",
      "rank": 2
    },
    {
      "role": "clip_g.layers.{i}.attn.qkv.bias#q",
      "pattern": "text_model.encoder.layers.{i}.self_attn.q_proj.bias",
      "rank": 1,
      "required": false
    },
    {
      "role": "clip_g.layers.{i}.attn.qkv.bias#k",
      "pattern": "text_model.encoder.layers.{i}.self_attn.k_proj.bias",
      "rank": 1,
      "required": false
    },
    {
      "role": "clip_g.layers.{i}.attn.qkv.bias#v",
      "pattern": "text_model.encoder.layers.{i}.self_attn.v_proj.bias",
      "rank": 1,
      "required": false
    }
  ]
}
