{
  "format": "tensorfs-contract-v1",
  "name": "dit.blocks-fused-qkv",
  "version": 1,
  "description": "The DiT/ViT block spelling shared by Flux-family and timm-derived transformers: one fused qkv per block along the outermost axis, equal thirds, plus the removable AdaLN modulation set.",
  "tensors": [
    {
      "role": "blocks.{i}.attn.qkv.weight",
      "pattern": "blocks.{i}.attn.qkv.weight",
      "rank": 2,
      "fusion": {
        "axis": 0,
        "parts": [
          { "role": "q", "share": 1 },
          { "role": "k", "share": 1 },
          { "role": "v", "share": 1 }
        ]
      }
    },
    {
      "role": "blocks.{i}.attn.qkv.bias",
      "pattern": "blocks.{i}.attn.qkv.bias",
      "rank": 1,
      "required": false,
      "fusion": {
        "axis": 0,
        "parts": [
          { "role": "q", "share": 1 },
          { "role": "k", "share": 1 },
          { "role": "v", "share": 1 }
        ]
      }
    },
    {
      "role": "blocks.{i}.attn.proj.weight",
      "pattern": "blocks.{i}.attn.proj.weight",
      "rank": 2,
      "required": false
    },
    {
      "role": "blocks.{i}.adaln.{i}.weight",
      "pattern": "blocks.{i}.adaLN_modulation.{i}.weight",
      "required": false
    },
    {
      "role": "blocks.{i}.adaln.{i}.bias",
      "pattern": "blocks.{i}.adaLN_modulation.{i}.bias",
      "required": false
    }
  ],
  "sets": {
    "adaln_projections": [
      "blocks.{i}.adaLN_modulation.{i}.weight",
      "blocks.{i}.adaLN_modulation.{i}.bias"
    ]
  }
}
