{
  "format": "tensorfs-contract-v1",
  "name": "stable-audio.diffusers-fp16",
  "version": 1,
  "dtype": "float16",
  "description": "The canonical Stable Audio serve layout: the diffusers StableAudioDiTModel (StableAudioPipeline), all-fp16, every family derived from the real safetensors header of tensorhub/stable-audio-open (stabilityai/stable-audio-open-1.0 @f21265c1e2710b3bd2386596943f0007f55f802e) and cross-checked byte-for-byte in names/shapes/dtypes against tensorhub/foundation-1 (tintwotin/Foundation-1-Diffusers @bc4bd07e4c10f8e794e48336582448171f5dbd5f). ONE document serves BOTH checkpoints: their transformer headers share an identical sha256, and they differ only in weight VALUES, which is a checkpoint row rather than a second layout. TRANSFORMER ONLY. The AutoencoderOobleck and the T5 text encoder are deliberately absent: both are BYTE-IDENTICAL across the two checkpoints (vae af3c43eb..., text_encoder 6cf39d0c...), so declaring either would make family detection TIE between them; and the T5 encoder is name-identical (Jaccard 1.0, all 99 tensors) with musicgen's, which would tie two unrelated audio families to each other. fp16, not bf16: the served checkpoints histogram {F16: 445} and the hub records dtype=fp16; the endpoints' inherited plain.bf16@1 layout string disagrees with the bytes and dies with the se#769 migration. QKV is SPLIT (to_q/to_k/to_v are separate tensors), so no fusion is declared; the cross-attention k/v are 768-wide against 1536-wide q, the cross_attention_dim=768 asymmetry visible in the shapes.",
  "tensors": [
    {
      "role": "audio_in.conv.weight",
      "pattern": "preprocess_conv.weight",
      "dtypes": [
        "F16"
      ],
      "rank": 3,
      "required": false
    },
    {
      "role": "audio_out.conv.weight",
      "pattern": "postprocess_conv.weight",
      "dtypes": [
        "F16"
      ],
      "rank": 3,
      "required": false
    },
    {
      "role": "latent_in.proj.weight",
      "pattern": "proj_in.weight",
      "dtypes": [
        "F16"
      ],
      "rank": 2,
      "required": false
    },
    {
      "role": "latent_out.proj.weight",
      "pattern": "proj_out.weight",
      "dtypes": [
        "F16"
      ],
      "rank": 2,
      "required": false
    },
    {
      "role": "time_embed.fourier.weight",
      "pattern": "time_proj.weight",
      "dtypes": [
        "F16"
      ],
      "rank": 1,
      "required": false
    },
    {
      "role": "time_embed.mlp.{i}.weight",
      "pattern": "timestep_proj.{i}.weight",
      "dtypes": [
        "F16"
      ],
      "rank": 2,
      "required": false
    },
    {
      "role": "time_embed.mlp.{i}.bias",
      "pattern": "timestep_proj.{i}.bias",
      "dtypes": [
        "F16"
      ],
      "rank": 1,
      "required": false
    },
    {
      "role": "global_cond.mlp.{i}.weight",
      "pattern": "global_proj.{i}.weight",
      "dtypes": [
        "F16"
      ],
      "rank": 2,
      "required": false
    },
    {
      "role": "cross_cond.mlp.{i}.weight",
      "pattern": "cross_attention_proj.{i}.weight",
      "dtypes": [
        "F16"
      ],
      "rank": 2,
      "required": false
    },
    {
      "role": "dit.{i}.norm1.weight",
      "pattern": "transformer_blocks.{i}.norm1.weight",
      "dtypes": [
        "F16"
      ],
      "rank": 1,
      "required": false
    },
    {
      "role": "dit.{i}.norm1.bias",
      "pattern": "transformer_blocks.{i}.norm1.bias",
      "dtypes": [
        "F16"
      ],
      "rank": 1,
      "required": false
    },
    {
      "role": "dit.{i}.norm2.weight",
      "pattern": "transformer_blocks.{i}.norm2.weight",
      "dtypes": [
        "F16"
      ],
      "rank": 1,
      "required": false
    },
    {
      "role": "dit.{i}.norm2.bias",
      "pattern": "transformer_blocks.{i}.norm2.bias",
      "dtypes": [
        "F16"
      ],
      "rank": 1,
      "required": false
    },
    {
      "role": "dit.{i}.norm3.weight",
      "pattern": "transformer_blocks.{i}.norm3.weight",
      "dtypes": [
        "F16"
      ],
      "rank": 1,
      "required": false
    },
    {
      "role": "dit.{i}.norm3.bias",
      "pattern": "transformer_blocks.{i}.norm3.bias",
      "dtypes": [
        "F16"
      ],
      "rank": 1,
      "required": false
    },
    {
      "role": "dit.{i}.self_attn.q.weight",
      "pattern": "transformer_blocks.{i}.attn1.to_q.weight",
      "dtypes": [
        "F16"
      ],
      "rank": 2,
      "required": false
    },
    {
      "role": "dit.{i}.self_attn.k.weight",
      "pattern": "transformer_blocks.{i}.attn1.to_k.weight",
      "dtypes": [
        "F16"
      ],
      "rank": 2,
      "required": false
    },
    {
      "role": "dit.{i}.self_attn.v.weight",
      "pattern": "transformer_blocks.{i}.attn1.to_v.weight",
      "dtypes": [
        "F16"
      ],
      "rank": 2,
      "required": false
    },
    {
      "role": "dit.{i}.self_attn.out.{i}.weight",
      "pattern": "transformer_blocks.{i}.attn1.to_out.{i}.weight",
      "dtypes": [
        "F16"
      ],
      "rank": 2,
      "required": false
    },
    {
      "role": "dit.{i}.cross_attn.q.weight",
      "pattern": "transformer_blocks.{i}.attn2.to_q.weight",
      "dtypes": [
        "F16"
      ],
      "rank": 2,
      "required": false
    },
    {
      "role": "dit.{i}.cross_attn.k.weight",
      "pattern": "transformer_blocks.{i}.attn2.to_k.weight",
      "dtypes": [
        "F16"
      ],
      "rank": 2,
      "required": false
    },
    {
      "role": "dit.{i}.cross_attn.v.weight",
      "pattern": "transformer_blocks.{i}.attn2.to_v.weight",
      "dtypes": [
        "F16"
      ],
      "rank": 2,
      "required": false
    },
    {
      "role": "dit.{i}.cross_attn.out.{i}.weight",
      "pattern": "transformer_blocks.{i}.attn2.to_out.{i}.weight",
      "dtypes": [
        "F16"
      ],
      "rank": 2,
      "required": false
    },
    {
      "role": "dit.{i}.ff.{i}.geglu.weight",
      "pattern": "transformer_blocks.{i}.ff.net.{i}.proj.weight",
      "dtypes": [
        "F16"
      ],
      "rank": 2,
      "required": false
    },
    {
      "role": "dit.{i}.ff.{i}.geglu.bias",
      "pattern": "transformer_blocks.{i}.ff.net.{i}.proj.bias",
      "dtypes": [
        "F16"
      ],
      "rank": 1,
      "required": false
    },
    {
      "role": "dit.{i}.ff.{i}.out.weight",
      "pattern": "transformer_blocks.{i}.ff.net.{i}.weight",
      "dtypes": [
        "F16"
      ],
      "rank": 2,
      "required": false
    },
    {
      "role": "dit.{i}.ff.{i}.out.bias",
      "pattern": "transformer_blocks.{i}.ff.net.{i}.bias",
      "dtypes": [
        "F16"
      ],
      "rank": 1,
      "required": false
    }
  ]
}
